{
  "schema_version": 1,
  "approval_id": "55555555-5555-4555-8555-555555555555",
  "owner_id": "33333333-3333-4333-8333-333333333333",
  "plan_id": "22222222-2222-4222-8222-222222222222",
  "plan_digest": "1082f07421b9d3b91919a04a0c28e398f391d2956229d93c4b2dc8f7d4c37d77",
  "approver_credential_id": "ops-approve",
  "approved_at": "2026-09-10T00:00:00Z",
  "start_before": "2026-09-10T00:15:00Z",
  "max_runtime_seconds": 120
}
